{
  "run_id": "20251221_115332",
  "type": "full_matrix",
  "address": "EDD9B34C-4842-FF30-7A6D-768CAAFCFFCA",
  "scenarios": [
    "baseline",
    "hand_behind_body",
    "phone_in_pocket",
    "phone_in_backpack"
  ],
  "phys": [
    "coded",
    "auto"
  ],
  "payloads": [
    60,
    120
  ],
  "repeats": 1,
  "started_at": "2025-12-21T11:41:00.993596+00:00",
  "ended_at": "2025-12-21T11:53:32.732317+00:00",
  "status": "completed",
  "errors": [],
  "outputs": {
    "throughput_csv": "results/tables/full_matrix_throughput.csv",
    "latency_csv": "results/tables/full_matrix_latency.csv",
    "rssi_csv": "results/tables/full_matrix_rssi.csv",
    "plots_dir": "results/plots"
  },
  "summary": {
    "baseline|coded": {
      "avg_throughput_kbps": 21.9606758682646,
      "total_packets": 1820,
      "total_loss": 96,
      "total_trials": 2,
      "retry_trials": 0,
      "error_trials": 0
    },
    "baseline|auto": {
      "avg_throughput_kbps": 21.688954890974298,
      "total_packets": 1812,
      "total_loss": 97,
      "total_trials": 2,
      "retry_trials": 0,
      "error_trials": 0
    },
    "hand_behind_body|coded": {
      "avg_throughput_kbps": 21.074583984238153,
      "total_packets": 1753,
      "total_loss": 71,
      "total_trials": 2,
      "retry_trials": 0,
      "error_trials": 0
    },
    "hand_behind_body|auto": {
      "avg_throughput_kbps": 21.297577718636592,
      "total_packets": 1774,
      "total_loss": 53,
      "total_trials": 2,
      "retry_trials": 1,
      "error_trials": 0
    },
    "phone_in_pocket|coded": {
      "avg_throughput_kbps": 21.029745879426585,
      "total_packets": 1760,
      "total_loss": 72,
      "total_trials": 2,
      "retry_trials": 0,
      "error_trials": 0
    },
    "phone_in_pocket|auto": {
      "avg_throughput_kbps": 21.263318273308478,
      "total_packets": 1772,
      "total_loss": 59,
      "total_trials": 2,
      "retry_trials": 0,
      "error_trials": 0
    },
    "phone_in_backpack|coded": {
      "avg_throughput_kbps": 21.36519369200578,
      "total_packets": 1777,
      "total_loss": 53,
      "total_trials": 2,
      "retry_trials": 1,
      "error_trials": 0
    },
    "phone_in_backpack|auto": {
      "avg_throughput_kbps": 21.171070030892608,
      "total_packets": 1759,
      "total_loss": 63,
      "total_trials": 2,
      "retry_trials": 0,
      "error_trials": 0
    }
  },
  "args": {
    "note": "mac sanity",
    "mtu": 247,
    "connect_timeout_s": 20.0,
    "connect_attempts": 3,
    "connect_retry_delay_s": 5.0
  }
}